pub_date,title,venue,excerpt,citation,url_slug,paper_url
3/19/20,De Grote Boze Markt,De Standaard,,,De-standaard-190320,https://davidvandijcke.github.io/images/DeStandaard_19032020.jpg
11/26/20,When bigger isnâ€™t better: UK firmsâ equity price performance during the Covid-19 pandemic,Bank Underground,,,Bank-underground,https://bankunderground.co.uk/2020/11/26/when-bigger-isnt-better-uk-firms-equity-price-performance-during-the-covid-19-pandemic/
4/13/21,Biden's plea for masks will fail. Blame political polarization.,Washington Post,,,Wapo-masks,https://www.washingtonpost.com/outlook/2021/04/13/masks-mandate-partisanship-politics/
1/21/22,"Who were the Jan. 6 attackers? Isolated white folks, searching for meaning âand enemies",Salon,New research offers clearer picture: Capitol rioters were often suburban and middle-class â€” and many felt isolated,,Salon-insurrection,https://www.salon.com/2022/01/21/new-research-trumpists-jan-6-loneliness-feeling-isolated-dems-non-whites-and-liberals/
3/19/21,"From coastal cities to rural towns, breadth of George Floyd protests, most peaceful, captured by data",USA Today,,,Usa-today-floyd,https://eu.usatoday.com/story/news/politics/2020/06/10/george-floyd-black-lives-matter-police-protests-widespread-peaceful/5325737002/
12/23/20,Political polarisation impedes the public policy response to COVID-19,Vox EU,,,Vox-eu-masks,https://voxeu.org/article/political-polarisation-impedes-public-policy-response-covid-19
1/5/22,Science skepticism appears to be an important predictor of non-compliance with COVID-19 shelter-in-place policies,PsyPost,,,Pyspost-covid,https://www.psypost.org/2022/01/science-skepticism-appears-to-be-an-important-predictor-of-non-compliance-with-covid-19-shelter-in-place-policies-62322
2/5/21,Here's What a Ton of Capitol Rioters Had in Common,The Daily Beast,,,Daily-beast-insurrection,https://www.thedailybeast.com/heres-what-a-ton-of-capitol-rioters-had-in-common
3/3/23,New data paints a picture of a year of war in Ukraine,Fast Company,Cell phone data and radar technology show how utterly disrupted life in Ukraine has beenÑand how incredibly resilient its people are.,,fast-company,https://www.fastcompany.com/90859731/new-data-paints-a-picture-of-a-year-of-war-in-ukraine